{
  "test_id": "KOLLMEYER_HG2_INR18650_CAP_CHECK_DIS_-10C_0p5",
  "cell_id": "KOLLMEYER_HG2_INR18650",
  "test_type": "C0p5Discharge",
  "temperature_C_min": -10.0,
  "temperature_C_max": -10.0,
  "soc_range_min": null,
  "soc_range_max": null,
  "soc_step": null,
  "soc_method": null,
  "c_rate_charge": null,
  "c_rate_discharge": null,
  "protocol_description": "Constant-current discharge at specified C-rate",
  "num_cycles": 1,
  "soh_pct": 100.0,
  "soh_method": "bol_assumption",
  "cycle_count_at_test": 0,
  "checkup_id": null,
  "test_year": 2020,
  "n_samples": 302,
  "duration_s": 17845.98499685526,
  "voltage_observed_min_V": 2.79993,
  "voltage_observed_max_V": 4.19995,
  "current_observed_min_A": -1.49925,
  "current_observed_max_A": 3.00108,
  "temperature_observed_min_C": -10.93649,
  "temperature_observed_max_C": 25.65868,
  "sample_dt_min_s": 0.0,
  "sample_dt_median_s": 59.99999642372131,
  "sample_dt_max_s": 60.01100018620491,
  "coulomb_count_observed_min_Ah": -2.33322,
  "coulomb_count_observed_max_Ah": 2.4338,
  "source_doi": "10.17632/cp3473x7xv.3",
  "source_url": "https://data.mendeley.com/datasets/cp3473x7xv/3",
  "source_citation": "Kollmeyer, P., Vidal, C., Naguib, M., Skells, M. (2020). LG 18650HG2 Li-ion Battery Data and Example Deep Neural Network xEV SOC Estimator Script. Mendeley Data, v3. https://doi.org/10.17632/cp3473x7xv.3",
  "source_license": "CC-BY-4.0",
  "source_license_url": "https://creativecommons.org/licenses/by/4.0/"
}