{
  "test_id": "KOLLMEYER_30T_AGING_BCNP_1s_DCH_2C_CYC267",
  "cell_id": "KOLLMEYER_30T_AGING_BCNP_1s",
  "test_type": "C2Discharge",
  "temperature_C_min": 25.0,
  "temperature_C_max": 25.0,
  "soc_range_min": null,
  "soc_range_max": null,
  "soc_step": null,
  "soc_method": null,
  "c_rate_charge": null,
  "c_rate_discharge": 2.0,
  "protocol_description": "DCH_2C characterization in BCNP_1s aging campaign at folder cycle 264 (file cycle #267)",
  "num_cycles": 1,
  "soh_pct": 94.49300699300699,
  "soh_method": "capacity_vs_first_checkpoint",
  "cycle_count_at_test": 264,
  "checkup_id": "KOLLMEYER_30T_AGING_BCNP_1s_CHECKUP_0264",
  "test_year": 2024,
  "n_samples": 1661,
  "duration_s": 1659.464,
  "voltage_observed_min_V": 2.5,
  "voltage_observed_max_V": 4.1039,
  "current_observed_min_A": -6.0053,
  "current_observed_max_A": -6.0016,
  "temperature_observed_min_C": 25.094,
  "temperature_observed_max_C": 28.889,
  "sample_dt_min_s": 0.4629999999961001,
  "sample_dt_median_s": 1.0,
  "sample_dt_max_s": 1.0030000000042492,
  "coulomb_count_observed_min_Ah": -2.7677,
  "coulomb_count_observed_max_Ah": -0.00166,
  "source_doi": "10.5683/SP3/UYPYDJ",
  "source_url": "https://borealisdata.ca/dataset.xhtml?persistentId=doi:10.5683/SP3/UYPYDJ",
  "source_citation": "Duque, J., Kollmeyer, P. J., Naguib, M. (2023, updated 2025). Battery Aging Dataset for 15 Minute Fast Charging of Samsung 30T Cells. Borealis Data Repository. https://doi.org/10.5683/SP3/UYPYDJ",
  "source_license": "CC-BY-4.0",
  "source_license_url": "https://creativecommons.org/licenses/by/4.0/"
}