{
  "test_id": "HNEI_PANASONIC_18650PF_DRIVE_CYCLE_US06_0C",
  "cell_id": "HNEI_PANASONIC_18650PF",
  "test_type": "drive_cycle",
  "temperature_C_min": 0.0,
  "temperature_C_max": 0.0,
  "soc_range_min": null,
  "soc_range_max": null,
  "soc_step": null,
  "soc_method": null,
  "c_rate_charge": null,
  "c_rate_discharge": null,
  "protocol_description": "US06 Supplemental Federal Test Procedure (high-acceleration) drive cycle",
  "num_cycles": 1,
  "soh_pct": 100.0,
  "soh_method": "bol_assumption",
  "cycle_count_at_test": 0,
  "checkup_id": null,
  "test_year": 2017,
  "n_samples": 36632,
  "duration_s": 3672.339002788067,
  "voltage_observed_min_V": 2.4924,
  "voltage_observed_max_V": 4.1748,
  "current_observed_min_A": -13.43748,
  "current_observed_max_A": 0.0,
  "temperature_observed_min_C": 0.5395334999999997,
  "temperature_observed_max_C": 13.987423666666666,
  "sample_dt_min_s": 0.0,
  "sample_dt_median_s": 0.09999945759773254,
  "sample_dt_max_s": 2.153991535305977,
  "coulomb_count_observed_min_Ah": -2.32008,
  "coulomb_count_observed_max_Ah": 0.0,
  "source_doi": "10.17632/wykht8y7tg.1",
  "source_url": "https://data.mendeley.com/datasets/wykht8y7tg/1",
  "source_citation": "Kollmeyer, P. (2018). Panasonic 18650PF Li-ion Battery Data. Mendeley Data, v1. https://doi.org/10.17632/wykht8y7tg.1",
  "source_license": "CC-BY-4.0",
  "source_license_url": "https://creativecommons.org/licenses/by/4.0/"
}