{
  "test_id": "KOLLMEYER_30T_INR21700_DRIVE_CYCLE_MIXED_-10C_2",
  "cell_id": "KOLLMEYER_30T_INR21700",
  "test_type": "drive_cycle",
  "temperature_C_min": -10.0,
  "temperature_C_max": -10.0,
  "soc_range_min": null,
  "soc_range_max": null,
  "soc_step": null,
  "soc_method": null,
  "c_rate_charge": null,
  "c_rate_discharge": null,
  "protocol_description": "Mixed randomized drive cycle (Mixed1..Mixed8 - Kollmeyer training profile)",
  "num_cycles": 1,
  "soh_pct": 100.0,
  "soh_method": "bol_assumption",
  "cycle_count_at_test": 0,
  "checkup_id": null,
  "test_year": 2022,
  "n_samples": 31427,
  "duration_s": 3142.4599919468164,
  "voltage_observed_min_V": 2.5769256354,
  "voltage_observed_max_V": 4.2011337438,
  "current_observed_min_A": -35.706170238,
  "current_observed_max_A": 3.006191518,
  "temperature_observed_min_C": -9.148792305,
  "temperature_observed_max_C": 0.8412682579,
  "sample_dt_min_s": 0.010993704199790955,
  "sample_dt_median_s": 0.09999945759773254,
  "sample_dt_max_s": 0.12399852275848389,
  "coulomb_count_observed_min_Ah": -2.4584316811,
  "coulomb_count_observed_max_Ah": 0.0007014782,
  "source_doi": "10.17632/9xyvy2njj3.2",
  "source_url": "https://data.mendeley.com/datasets/9xyvy2njj3/2",
  "source_citation": "Kollmeyer, P., Skells, M. (2022). Samsung INR21700 30T 3Ah Li-ion Battery Data. Mendeley Data, v2. https://doi.org/10.17632/9xyvy2njj3.2",
  "source_license": "CC-BY-4.0",
  "source_license_url": "https://creativecommons.org/licenses/by/4.0/"
}