{
  "test_id": "KOLLMEYER_30T_AGING_CC2_HPPC_CYC981",
  "cell_id": "KOLLMEYER_30T_AGING_CC2",
  "test_type": "hppc",
  "temperature_C_min": 25.0,
  "temperature_C_max": 25.0,
  "soc_range_min": null,
  "soc_range_max": null,
  "soc_step": 0.1,
  "soc_method": null,
  "c_rate_charge": null,
  "c_rate_discharge": null,
  "protocol_description": "HPPC characterization in CC2 aging campaign at folder cycle 976 (file cycle #981)",
  "num_cycles": 1,
  "soh_pct": 84.5068055788943,
  "soh_method": "capacity_vs_first_checkpoint",
  "cycle_count_at_test": 976,
  "checkup_id": "KOLLMEYER_30T_AGING_CC2_CHECKUP_0976",
  "test_year": 2024,
  "n_samples": 34946,
  "duration_s": 108447.98299999998,
  "voltage_observed_min_V": 2.4978,
  "voltage_observed_max_V": 4.2059,
  "current_observed_min_A": -28.919,
  "current_observed_max_A": 25.149,
  "temperature_observed_min_C": 23.844,
  "temperature_observed_max_C": 27.844,
  "sample_dt_min_s": 0.0009999999892897904,
  "sample_dt_median_s": 1.0,
  "sample_dt_max_s": 60.046000000002095,
  "coulomb_count_observed_min_Ah": -2.5762000000000005,
  "coulomb_count_observed_max_Ah": 0.004589999999999997,
  "source_doi": "10.5683/SP3/UYPYDJ",
  "source_url": "https://borealisdata.ca/dataset.xhtml?persistentId=doi:10.5683/SP3/UYPYDJ",
  "source_citation": "Duque, J., Kollmeyer, P. J., Naguib, M. (2023, updated 2025). Battery Aging Dataset for 15 Minute Fast Charging of Samsung 30T Cells. Borealis Data Repository. https://doi.org/10.5683/SP3/UYPYDJ",
  "source_license": "CC-BY-4.0",
  "source_license_url": "https://creativecommons.org/licenses/by/4.0/"
}