{
  "test_id": "NAUMANN_CAL_T25_SOC0_TEST",
  "cell_id": "NAUMANN_CAL_T25_SOC0",
  "test_type": "calendar_aging",
  "temperature_C_min": 25.0,
  "temperature_C_max": 25.0,
  "soc_range_min": 0.0,
  "soc_range_max": 0.0,
  "soc_step": null,
  "soc_method": "source_published",
  "c_rate_charge": null,
  "c_rate_discharge": null,
  "protocol_description": "Calendar aging at T=25 degC, SOC=0%. Periodic checkups (capacity + R_DC,10s pulse) at the storage SOC. Published as aggregated mean across 3 replicates - one logical cell_id per (T, SOC) test point.",
  "num_cycles": 35,
  "soh_pct": null,
  "soh_method": null,
  "cycle_count_at_test": 0,
  "checkup_id": null,
  "test_year": 2018,
  "n_samples": 0,
  "duration_s": 76467600.0,
  "voltage_observed_min_V": null,
  "voltage_observed_max_V": null,
  "current_observed_min_A": null,
  "current_observed_max_A": null,
  "temperature_observed_min_C": null,
  "temperature_observed_max_C": null,
  "sample_dt_min_s": null,
  "sample_dt_median_s": null,
  "sample_dt_max_s": null,
  "coulomb_count_observed_min_Ah": null,
  "coulomb_count_observed_max_Ah": null,
  "source_doi": "10.17632/kxh42bfgtj.1",
  "source_url": "https://data.mendeley.com/datasets/kxh42bfgtj/1",
  "source_citation": "Naumann, M. (2021). Data for: Analysis and modeling of calendar/cycle aging of a commercial LiFePO4/graphite cell. Mendeley Data. DOIs: 10.17632/kxh42bfgtj.1 (calendar) and 10.17632/6hgyr25h8d.1 (cycle). Companion papers: Naumann et al. JPS 2018 doi:10.1016/j.est.2018.01.019, Naumann et al. JPS 2020 doi:10.1016/j.jpowsour.2019.227666",
  "source_license": "CC-BY-4.0",
  "source_license_url": "https://creativecommons.org/licenses/by/4.0/"
}