{
  "test_id": "MATR_B3C36_CYCLING",
  "cell_id": "MATR_B3C36",
  "test_type": "cycle_aging",
  "temperature_C_min": 30.0,
  "temperature_C_max": 30.0,
  "soc_range_min": null,
  "soc_range_max": null,
  "soc_step": null,
  "soc_method": null,
  "c_rate_charge": 5.6,
  "c_rate_discharge": 4.0,
  "protocol_description": "Fast-charge aging at 30 degC. Charge policy: 5.6C(36%)-4.3C-newstructure. 4C discharge. Cycled to 80% capacity retention (EOL).",
  "num_cycles": 923,
  "soh_pct": null,
  "soh_method": null,
  "cycle_count_at_test": 0,
  "checkup_id": null,
  "test_year": 2018,
  "n_samples": 678650,
  "duration_s": 2300765.4455000036,
  "voltage_observed_min_V": 1.9683008,
  "voltage_observed_max_V": 3.6003199,
  "current_observed_min_A": -4.002694636363636,
  "current_observed_max_A": 5.608274272727272,
  "temperature_observed_min_C": 31.939495,
  "temperature_observed_max_C": 43.772045,
  "sample_dt_min_s": 0.000599999912083149,
  "sample_dt_median_s": 5.004100000020117,
  "sample_dt_max_s": 5.059200000017881,
  "coulomb_count_observed_min_Ah": -0.0005116999999998928,
  "coulomb_count_observed_max_Ah": 1.06051836125975,
  "source_doi": "10.1038/s41560-019-0356-8",
  "source_url": "https://data.matr.io/1/projects/5c48dd2bc625d700019f3204",
  "source_citation": "Severson, K. A., Attia, P. M., Jin, N., et al. (2019). Data-driven prediction of battery cycle life before capacity degradation. Nature Energy 4, 383-391. https://doi.org/10.1038/s41560-019-0356-8",
  "source_license": "CC-BY-4.0",
  "source_license_url": "https://creativecommons.org/licenses/by/4.0/"
}