{
  "test_id": "KOLLMEYER_30T_INR21700_HPPC_10C",
  "cell_id": "KOLLMEYER_30T_INR21700",
  "test_type": "hppc",
  "temperature_C_min": 10.0,
  "temperature_C_max": 10.0,
  "soc_range_min": null,
  "soc_range_max": null,
  "soc_step": 0.1,
  "soc_method": null,
  "c_rate_charge": null,
  "c_rate_discharge": null,
  "protocol_description": "Multi-rate HPPC at 10% SOC steps (Kollmeyer 30T protocol)",
  "num_cycles": 1,
  "soh_pct": 100.0,
  "soh_method": "bol_assumption",
  "cycle_count_at_test": 0,
  "checkup_id": null,
  "test_year": 2022,
  "n_samples": 51514,
  "duration_s": 138988.12299706042,
  "voltage_observed_min_V": 2.49989,
  "voltage_observed_max_V": 4.20029,
  "current_observed_min_A": -35.99989,
  "current_observed_max_A": 5.99961,
  "temperature_observed_min_C": 8.83332,
  "temperature_observed_max_C": 25.44836,
  "sample_dt_min_s": 0.0,
  "sample_dt_median_s": 0.102996826171875,
  "sample_dt_max_s": 67.33499988913536,
  "coulomb_count_observed_min_Ah": -2.84234,
  "coulomb_count_observed_max_Ah": 2.88925,
  "source_doi": "10.17632/9xyvy2njj3.2",
  "source_url": "https://data.mendeley.com/datasets/9xyvy2njj3/2",
  "source_citation": "Kollmeyer, P., Skells, M. (2022). Samsung INR21700 30T 3Ah Li-ion Battery Data. Mendeley Data, v2. https://doi.org/10.17632/9xyvy2njj3.2",
  "source_license": "CC-BY-4.0",
  "source_license_url": "https://creativecommons.org/licenses/by/4.0/"
}