{
  "test_id": "BILLS_EVTOL_VAH26_DRIVE_CYCLE",
  "cell_id": "BILLS_EVTOL_VAH26",
  "test_type": "drive_cycle",
  "temperature_C_min": 16.546406,
  "temperature_C_max": 62.422203,
  "soc_range_min": null,
  "soc_range_max": null,
  "soc_step": null,
  "soc_method": null,
  "c_rate_charge": 1.0,
  "c_rate_discharge": null,
  "protocol_description": "eVTOL mission profile (54 W takeoff 75 s + 16 W cruise 800 s + 54 W landing 105 s) repeated until EOL. Interspersed RPTs every 50 missions with C/5 capacity test + DCIR pulses.",
  "num_cycles": 249,
  "soh_pct": null,
  "soh_method": null,
  "cycle_count_at_test": 0,
  "checkup_id": null,
  "test_year": 2020,
  "n_samples": 718345,
  "duration_s": 8060177.2775746,
  "voltage_observed_min_V": 2.4999251,
  "voltage_observed_max_V": 4.2038031,
  "current_observed_min_A": -21.594901999999998,
  "current_observed_max_A": 3.0067263,
  "temperature_observed_min_C": 16.546406,
  "temperature_observed_max_C": 62.422203,
  "sample_dt_min_s": 0.0,
  "sample_dt_median_s": 1.0000001201406121,
  "sample_dt_max_s": 30.054003139957786,
  "coulomb_count_observed_min_Ah": -3.05275814598762,
  "coulomb_count_observed_max_Ah": 3.0588118750929003,
  "source_doi": "10.1184/R1/14226830",
  "source_url": "https://kilthub.cmu.edu/articles/dataset/eVTOL_Battery_Dataset/14226830",
  "source_citation": "Bills, A., Sripad, S., Fredericks, W. L., et al. (2023). A battery dataset for electric vertical takeoff and landing aircraft. Scientific Data 10, 344. https://doi.org/10.1038/s41597-023-02180-5",
  "source_license": "CC-BY-4.0",
  "source_license_url": "https://creativecommons.org/licenses/by/4.0/"
}